{"host_id":"codex","probed_at":"2026-08-16T00:00:00Z","last_verified_at":"2026-08-16T00:00:00Z","probe_status":"PARTIAL","validity_fingerprint":null,"hook_definition_digest":null,"relevant_config_digest":null,"stale_reason":"VALIDITY_FINGERPRINT_UNPROVEN","plugin_supported":true,"plugin_installed":null,"hooks_supported":null,"hooks_configured":null,"hook_trust_required":null,"hooks_trusted":null,"hooks_enabled":null,"hooks_allowed_by_admin_policy":null,"hook_coverage_class":"UNKNOWN","required_hook_coverage_satisfied":null,"selected_mode":"SUPERVISED","mode_override":null,"inactive_reason":"UNKNOWN"}
