{"host_id":"claude-code","probed_at":"2026-08-16T00:00:00Z","last_verified_at":"2026-08-16T00:00:00Z","probe_status":"COMPLETE","validity_fingerprint":"sha256:current","hook_definition_digest":"sha256:hook","relevant_config_digest":"sha256:config","stale_reason":"NONE","plugin_supported":true,"plugin_installed":true,"hooks_supported":true,"hooks_configured":true,"hook_trust_required":false,"hooks_trusted":null,"hooks_enabled":true,"hooks_allowed_by_admin_policy":true,"hook_coverage_class":"FULL","required_hook_coverage_satisfied":true,"selected_mode":"SUPERVISED","mode_override":{"source":"DEBUG","reason":"fixture forces supervised"},"inactive_reason":"MODE_OVERRIDE"}
