{
  "host_id": "codex",
  "host_version": "1.9.0",
  "probed_at": "2026-08-16T04:00:00Z",
  "plugin_supported": true,
  "plugin_installed": true,
  "manifest_path": "plugins/codex/.codex-plugin/plugin.json",
  "supports_skills": true,
  "supports_commands": true,
  "supports_subagents": true,
  "supports_mcp": true,
  "hooks_supported": true,
  "hooks_configured": true,
  "hook_trust_required": true,
  "hooks_trusted": true,
  "hooks_enabled": true,
  "hooks_allowed_by_admin_policy": true,
  "hook_events": [
    "SessionStart",
    "PostToolUse"
  ],
  "blocking_hook_events": [],
  "hook_coverage_class": "PARTIAL",
  "required_hook_coverage_satisfied": false,
  "selected_mode": "HYBRID",
  "inactive_reason": "INSUFFICIENT_COVERAGE",
  "plugin_data_path": "/home/user/.codex/plugins/receipts/data",
  "sandbox_modes": [
    "read-only",
    "workspace-write"
  ],
  "evidence_label": "VERIFIED_CURRENT_SELF_FETCHED",
  "source_claim_id": "C-02",
  "probe_status": "COMPLETE",
  "validity_fingerprint": "sha256:fixture-current",
  "hook_definition_digest": "sha256:fixture-hook",
  "relevant_config_digest": "sha256:fixture-config",
  "last_verified_at": "2026-08-16T04:00:00Z",
  "stale_reason": "NONE",
  "mode_override": null
}
